{
  "continent_code": "EU",
  "continent_name": "Europe",
  "country_code2": "SE",
  "country_code3": "SWE",
  "country_name": "Sweden",
  "country_name_official": "Kingdom of Sweden",
  "country_capital": "Stockholm",
  "state_prov": "Stockholms l\u00e4n",
  "state_code": "SE-AB",
  "district": "Stockholm",
  "city": "Stockholm",
  "locality": "Stockholm",
  "accuracy_radius": "4.395",
  "confidence": "high",
  "dma_code": "504",
  "zipcode": "164 40",
  "latitude": "59.40510",
  "longitude": "17.95510",
  "is_eu": true,
  "country_flag": "https://ipgeolocation.io/static/flags/se_64.png",
  "geoname_id": "9972319",
  "country_emoji": "\ud83c\uddf8\ud83c\uddea"
}